{
  "@context": "https://purl.org/gag/schema/http_availability.jsonld",
  "timestamp": "2026-02-07T16:09:53.963070",
  "status": "passed",
  "summary": {
    "total": 10,
    "accessible": 10,
    "inaccessible": 0
  },
  "results": [
    {
      "url": "https://purl.org/gag/schema/dirtree.json",
      "status_code": 200,
      "message": "OK",
      "ok": true,
      "redirect_history": [
        "https://purl.org/gag/schema/dirtree.json",
        "https://purl.archive.org/gag/schema/dirtree.json"
      ]
    },
    {
      "url": "https://purl.org/gag/schema/dirtree.jsonld",
      "status_code": 200,
      "message": "OK",
      "ok": true,
      "redirect_history": [
        "https://purl.org/gag/schema/dirtree.jsonld",
        "https://purl.archive.org/gag/schema/dirtree.jsonld"
      ]
    },
    {
      "url": "https://purl.org/gag/schema/filelist.json",
      "status_code": 200,
      "message": "OK",
      "ok": true,
      "redirect_history": [
        "https://purl.org/gag/schema/filelist.json",
        "https://purl.archive.org/gag/schema/filelist.json"
      ]
    },
    {
      "url": "https://purl.org/gag/schema/filelist.jsonld",
      "status_code": 200,
      "message": "OK",
      "ok": true,
      "redirect_history": [
        "https://purl.org/gag/schema/filelist.jsonld",
        "https://purl.archive.org/gag/schema/filelist.jsonld"
      ]
    },
    {
      "url": "https://purl.org/gag/schema/http_availability.json",
      "status_code": 200,
      "message": "OK",
      "ok": true,
      "redirect_history": [
        "https://purl.org/gag/schema/http_availability.json",
        "https://purl.archive.org/gag/schema/http_availability.json"
      ]
    },
    {
      "url": "https://purl.org/gag/schema/http_availability.jsonld",
      "status_code": 200,
      "message": "OK",
      "ok": true,
      "redirect_history": [
        "https://purl.org/gag/schema/http_availability.jsonld",
        "https://purl.archive.org/gag/schema/http_availability.jsonld"
      ]
    },
    {
      "url": "https://purl.org/gag/schema/probe.json",
      "status_code": 200,
      "message": "OK",
      "ok": true,
      "redirect_history": [
        "https://purl.org/gag/schema/probe.json",
        "https://purl.archive.org/gag/schema/probe.json"
      ]
    },
    {
      "url": "https://purl.org/gag/schema/probe.jsonld",
      "status_code": 200,
      "message": "OK",
      "ok": true,
      "redirect_history": [
        "https://purl.org/gag/schema/probe.jsonld",
        "https://purl.archive.org/gag/schema/probe.jsonld"
      ]
    },
    {
      "url": "https://purl.org/gag/schema/uuid",
      "status_code": 200,
      "message": "OK",
      "ok": true,
      "redirect_history": [
        "https://purl.org/gag/schema/uuid",
        "https://purl.archive.org/gag/schema/uuid"
      ]
    },
    {
      "url": "https://purl.org/gag/schema/vocab",
      "status_code": 200,
      "message": "OK",
      "ok": true,
      "redirect_history": [
        "https://purl.org/gag/schema/vocab",
        "https://purl.archive.org/gag/schema/vocab"
      ]
    }
  ]
}